{
  "kind": "AutonomousClosureReadinessGateV1",
  "schemaVersion": 1,
  "generatedAt": "2026-06-11T00:00:00.000Z",
  "AutonomousClosureReadinessGateV1": true,
  "requiredGates": [
    "closure_gate_present_in_gap_ledger",
    "closure_gate_package_script_present",
    "closure_gate_script_exists",
    "closure_gate_top_harness_child_gate",
    "closure_gate_autonomy_contract_present",
    "closure_gate_docs_present",
    "closure_gate_strict_no_write_passes",
    "top_autonomous_false_until_closed"
  ],
  "readinessMatrix": {
    "kind": "AutonomousClosureReadinessMatrixV1",
    "schemaVersion": 1,
    "sourceLedger": {
      "kind": "AutonomousHardeningGapLedgerV1",
      "gapCount": 4,
      "closureGateCount": 4,
      "gapHash": "bbbbbbbbbbbbbbbbbbbbbbbbbbbbbbbbbbbbbbbbbbbbbbbbbbbbbbbbbbbbbbbb"
    },
    "summary": {
      "gapCount": 4,
      "closureGateCount": 4,
      "readyRows": 4,
      "failedRows": 0,
      "allClosureGatesExecutable": true,
      "allClosureGatesHarnessed": true,
      "topAutonomousDefinition": false
    },
    "closureRows": [
      {
        "gapId": "parallel.re_swarm_live_provider_manifest_parity",
        "pillar": "parallel_scheduling",
        "status": "ready_for_live",
        "closureGate": "gate:swarm-provider-manifest-parity",
        "scriptPath": "scripts/reverse-agent/swarm-provider-manifest-parity-gate.mjs",
        "npmScript": "node scripts/reverse-agent/swarm-provider-manifest-parity-gate.mjs . --strict",
        "packageScriptPresent": true,
        "gateScriptExists": true,
        "topHarnessChildGatePresent": true,
        "autonomyContractPresent": true,
        "docsPresent": ["README.md", "docs/reverse-agent/autonomous-control-plane.md", "docs/reverse-agent/README.md"],
        "strictNoWritePass": true,
        "acceptanceCriteriaBacked": true,
        "readyForLive": true,
        "evidenceRefs": ["package.json", "scripts/reverse-agent/repi-top-harness.mjs", "scripts/reverse-agent/autonomy-control-plane.mjs", "README.md"],
        "notClosedReason": "ready_for_live still requires broader live runtime samples before closed"
      },
      {
        "gapId": "context.cross_session_multi_compact_live_matrix",
        "pillar": "long_context_compaction",
        "status": "ready_for_live",
        "closureGate": "gate:cross-session-multi-compact-matrix",
        "scriptPath": "scripts/reverse-agent/cross-session-multi-compact-matrix-gate.mjs",
        "npmScript": "node scripts/reverse-agent/cross-session-multi-compact-matrix-gate.mjs . --strict",
        "packageScriptPresent": true,
        "gateScriptExists": true,
        "topHarnessChildGatePresent": true,
        "autonomyContractPresent": true,
        "docsPresent": ["README.md", "docs/reverse-agent/autonomous-control-plane.md", "packages/coding-agent/docs/recon.md"],
        "strictNoWritePass": true,
        "acceptanceCriteriaBacked": true,
        "readyForLive": true,
        "evidenceRefs": ["package.json", "scripts/reverse-agent/repi-top-harness.mjs", "scripts/reverse-agent/autonomy-control-plane.mjs", "README.md"],
        "notClosedReason": "ready_for_live still requires broader live runtime samples before closed"
      },
      {
        "gapId": "repair.provider_worker_rollback_unification",
        "pillar": "failure_self_repair",
        "status": "ready_for_live",
        "closureGate": "gate:worker-provider-repair-rollback-unification",
        "scriptPath": "scripts/reverse-agent/worker-provider-repair-rollback-unification-gate.mjs",
        "npmScript": "node scripts/reverse-agent/worker-provider-repair-rollback-unification-gate.mjs . --strict",
        "packageScriptPresent": true,
        "gateScriptExists": true,
        "topHarnessChildGatePresent": true,
        "autonomyContractPresent": true,
        "docsPresent": ["README.md", "docs/reverse-agent/autonomous-control-plane.md", "packages/coding-agent/docs/recon.md"],
        "strictNoWritePass": true,
        "acceptanceCriteriaBacked": true,
        "readyForLive": true,
        "evidenceRefs": ["package.json", "scripts/reverse-agent/repi-top-harness.mjs", "scripts/reverse-agent/autonomy-control-plane.mjs", "README.md"],
        "notClosedReason": "ready_for_live still requires broader live runtime samples before closed"
      },
      {
        "gapId": "claim.live_conflict_arbitration_matrix",
        "pillar": "automatic_division_validation",
        "status": "ready_for_live",
        "closureGate": "gate:live-conflict-arbitration-matrix",
        "scriptPath": "scripts/reverse-agent/live-conflict-arbitration-matrix-gate.mjs",
        "npmScript": "node scripts/reverse-agent/live-conflict-arbitration-matrix-gate.mjs . --strict",
        "packageScriptPresent": true,
        "gateScriptExists": true,
        "topHarnessChildGatePresent": true,
        "autonomyContractPresent": true,
        "docsPresent": ["README.md", "docs/reverse-agent/autonomous-control-plane.md", "docs/reverse-agent/README.md"],
        "strictNoWritePass": true,
        "acceptanceCriteriaBacked": true,
        "readyForLive": true,
        "evidenceRefs": ["package.json", "scripts/reverse-agent/repi-top-harness.mjs", "scripts/reverse-agent/autonomy-control-plane.mjs", "README.md"],
        "notClosedReason": "ready_for_live still requires broader live runtime samples before closed"
      }
    ],
    "promotionPolicy": {
      "mode": "strict_closure_gate_readiness",
      "topAutonomousDefinitionFalseUntilClosed": true,
      "readyForLiveDoesNotEqualClosed": true,
      "closedRequiresArtifactBackedRows": true
    }
  },
  "negativeCases": [
    { "id": "missing-package-script", "mutates": ["closureRows[0].packageScriptPresent=false"], "expect": "fail", "mustReject": true },
    { "id": "missing-top-harness-child-gate", "mutates": ["closureRows[0].topHarnessChildGatePresent=false"], "expect": "fail", "mustReject": true },
    { "id": "missing-autonomy-contract", "mutates": ["closureRows[0].autonomyContractPresent=false"], "expect": "fail", "mustReject": true },
    { "id": "missing-docs", "mutates": ["closureRows[0].docsPresent=[]"], "expect": "fail", "mustReject": true },
    { "id": "closure-gate-run-failed", "mutates": ["closureRows[0].strictNoWritePass=false"], "expect": "fail", "mustReject": true },
    { "id": "top-autonomous-true-with-ready-gaps", "mutates": ["summary.topAutonomousDefinition=true while rows are ready_for_live"], "expect": "fail", "mustReject": true },
    { "id": "closed-gap-without-artifact-backed-row", "mutates": ["closureRows[0].status=closed and acceptanceCriteriaBacked=false"], "expect": "fail", "mustReject": true }
  ],
  "invariants": [
    "closure_gate_present_in_gap_ledger",
    "closure_gate_package_script_present",
    "closure_gate_script_exists",
    "closure_gate_top_harness_child_gate",
    "closure_gate_autonomy_contract_present",
    "closure_gate_docs_present",
    "closure_gate_strict_no_write_passes",
    "top_autonomous_false_until_closed"
  ]
}
